{
  "schema_version": "1.0",
  "generated_at": "2026-05-29T04:08:33Z",
  "generated_by": "python_physics_fallback",
  "process": "spent_lfp_ballmill_li",
  "design_point_ton_per_batch": 1.0,
  "target_recovery": 0.9,
  "batch_hours": 1.0,
  "capacity_factor": 0.85,
  "batches_per_year": 7446.0,
  "scales_ton": [
    0.1,
    1.0,
    5.0
  ],
  "ball_mill": {
    "kWh_per_t_feed": 114.88426101382561,
    "kWh_per_t_feed_by_scale": [
      {
        "scale_ton": 0.1,
        "kWh_per_t": 123.10070354427025
      },
      {
        "scale_ton": 1.0,
        "kWh_per_t": 114.88426101382561
      },
      {
        "scale_ton": 5.0,
        "kWh_per_t": 109.46907160204225
      }
    ],
    "specific_energy_is_intensive": true,
    "drivetrain_credit_at_design": 1.0,
    "motor_kW_at_design_point": 114.88426101382561,
    "base_cost_usd": 2100574.6770817786,
    "bond_comminution_kWh_per_t": 13.40316378494632,
    "bond_fraction_of_total": 0.11666666666666667,
    "mill_diameter_m": 1.3326788663864138,
    "mill_length_m": 1.9990182995796206,
    "mill_volume_m3": 2.7884166841991185,
    "ball_charge_kg": 4149.164026088289,
    "specific_power_kW_per_m3": 41.200535653380065,
    "critical_speed_rpm": 36.64186851831832,
    "operating_speed_rpm": 27.48140138873874,
    "geometry_is_readout_only": true,
    "bond_work_index_kWh_per_t": 12.0,
    "feed_size_F80_um": 5000.0,
    "product_size_P80_um": 75.0,
    "activation_multiplier": 6.0,
    "mill_efficiency": 0.7,
    "mechanochem_intensity_factor": 50.0,
    "heat_load_kW_at_design_point": 103.39583491244305,
    "cooling_water_kg_per_t_feed": 4446.0703020161845,
    "cooling_water_usd_per_t_feed_per_y": 9931.631840643753
  },
  "leach_tank": {
    "target_recovery": 0.9,
    "reference_recovery": 0.9,
    "kinetic_model": "first_order",
    "rate_constant": 2.3,
    "residence_time_h": 1.0011239534756722,
    "residence_time_ref_h": 1.0011239534756722,
    "reactor_volume_m3": 5.775715116205801,
    "reactor_volume_ref_m3": 5.775715116205801,
    "safety_factor": 1.5,
    "base_cost_usd": 340000.0,
    "base_cost_usd_orig": 340000.0,
    "cost_scaling_factor": 0.6
  },
  "evaporator": {
    "feed_water_kg_per_batch": 5000.0,
    "evaporation_target_fraction": 0.85,
    "effects": 1,
    "Q_evap_MJ_per_batch": 11174.75,
    "lps_steam_kg_per_batch": 5374.543093497498,
    "lps_steam_kg_per_t_feed_per_y": 40018847.87418237,
    "lps_steam_usd_per_t_feed_per_y": 1000471.1968545592,
    "lps_price_usd_per_ton": 25.0,
    "heat_transfer_area_m2": 68.97993827160494,
    "single_effect_area_m2": 68.97993827160494,
    "U_W_per_m2K": 1500.0,
    "deltaT_total_K": 30.0,
    "area_cost_usd_per_m2": 4000.0,
    "base_cost_usd": 275919.7530864197,
    "boiler_feed_T_C": 25.0,
    "boil_T_C": 100.0,
    "specific_heat_water_kJ_per_kg_K": 4.186,
    "latent_heat_vap_kJ_per_kg": 2260.0
  }
}
